Question,Answer,Category,Keywords
How can I reset my password?,"To reset your password, go to the settings page and click on 'Forgot Password'.",Account Issues,"password, reset, account"
Where can I find the user manual?,The user manual can be found on the product page under the 'Documentation' section.,Product Information,"manual, user guide, instructions"
What is the refund policy?,"Our refund policy lasts 30 days. If 30 days have gone by since your purchase, unfortunately, we cannot offer you a refund or exchange.",Returns and Refunds,"refund, policy, money back"
How do I track my order?,You can track your order by logging into your account and visiting the 'Orders' section.,Order Management,"track order, delivery, status"
What are the warranty terms?,"Our products come with a one year warranty. For more details, please visit the warranty section on our website.",Warranty and Repairs,"warranty, guarantee, terms"
